{
  "root": "0xc2c4b9727dcdb1106f6d268ae70cceaf087c74238baa30b611dbf80f0dc40a43",
  "validationMode": "closed-world",
  "complete": true,
  "nodes": [
    {
      "hash": "0xc2c4b9727dcdb1106f6d268ae70cceaf087c74238baa30b611dbf80f0dc40a43",
      "minDepth": 0,
      "maxDepth": 0,
      "pathCount": 1,
      "parentCount": 4,
      "childCount": 0
    },
    {
      "hash": "0x65fda53426aad131da4262943667d7ff245819290d8106077385f2e3c5fbd664",
      "minDepth": 1,
      "maxDepth": 1,
      "pathCount": 1,
      "parentCount": 0,
      "childCount": 1
    },
    {
      "hash": "0x6607ad22c81a1253089c2e4dee9f6f5812af893e67a993fdcdb68760699d6082",
      "minDepth": 1,
      "maxDepth": 1,
      "pathCount": 1,
      "parentCount": 0,
      "childCount": 1
    },
    {
      "hash": "0x8651596b396d7e2e8ec56e260d503b8b9359bd402cd4e8bfa2da4633bae92333",
      "minDepth": 1,
      "maxDepth": 1,
      "pathCount": 1,
      "parentCount": 0,
      "childCount": 1
    },
    {
      "hash": "0xd203f5b464cf38ef7555c6afe7c5c685e4c3d640565170605fcc25832c36b4d8",
      "minDepth": 1,
      "maxDepth": 1,
      "pathCount": 1,
      "parentCount": 0,
      "childCount": 1
    }
  ],
  "edges": [
    {
      "from": "0xc2c4b9727dcdb1106f6d268ae70cceaf087c74238baa30b611dbf80f0dc40a43",
      "to": "0x65fda53426aad131da4262943667d7ff245819290d8106077385f2e3c5fbd664"
    },
    {
      "from": "0xc2c4b9727dcdb1106f6d268ae70cceaf087c74238baa30b611dbf80f0dc40a43",
      "to": "0x6607ad22c81a1253089c2e4dee9f6f5812af893e67a993fdcdb68760699d6082"
    },
    {
      "from": "0xc2c4b9727dcdb1106f6d268ae70cceaf087c74238baa30b611dbf80f0dc40a43",
      "to": "0x8651596b396d7e2e8ec56e260d503b8b9359bd402cd4e8bfa2da4633bae92333"
    },
    {
      "from": "0xc2c4b9727dcdb1106f6d268ae70cceaf087c74238baa30b611dbf80f0dc40a43",
      "to": "0xd203f5b464cf38ef7555c6afe7c5c685e4c3d640565170605fcc25832c36b4d8"
    }
  ],
  "leaves": [
    "0x65fda53426aad131da4262943667d7ff245819290d8106077385f2e3c5fbd664",
    "0x6607ad22c81a1253089c2e4dee9f6f5812af893e67a993fdcdb68760699d6082",
    "0x8651596b396d7e2e8ec56e260d503b8b9359bd402cd4e8bfa2da4633bae92333",
    "0xd203f5b464cf38ef7555c6afe7c5c685e4c3d640565170605fcc25832c36b4d8"
  ],
  "missingParents": [],
  "externalParents": [],
  "maxDepth": 1,
  "cycle": false
}
