{
  "root": "0x1fc2ca87dfb4b942ef0dc4ce420b46198451c56f5c8a1353e8b320bfa33ff4f4",
  "validationMode": "closed-world",
  "complete": true,
  "nodes": [
    {
      "hash": "0x1fc2ca87dfb4b942ef0dc4ce420b46198451c56f5c8a1353e8b320bfa33ff4f4",
      "minDepth": 0,
      "maxDepth": 0,
      "pathCount": 1,
      "parentCount": 4,
      "childCount": 0
    },
    {
      "hash": "0x65fda53426aad131da4262943667d7ff245819290d8106077385f2e3c5fbd664",
      "minDepth": 1,
      "maxDepth": 1,
      "pathCount": 1,
      "parentCount": 0,
      "childCount": 1
    },
    {
      "hash": "0x6607ad22c81a1253089c2e4dee9f6f5812af893e67a993fdcdb68760699d6082",
      "minDepth": 1,
      "maxDepth": 1,
      "pathCount": 1,
      "parentCount": 0,
      "childCount": 1
    },
    {
      "hash": "0x94c1d46d5db6c4b56429bad1d173bc258da6adf664ef365d9a59bd68284524d1",
      "minDepth": 1,
      "maxDepth": 1,
      "pathCount": 1,
      "parentCount": 0,
      "childCount": 1
    },
    {
      "hash": "0xd203f5b464cf38ef7555c6afe7c5c685e4c3d640565170605fcc25832c36b4d8",
      "minDepth": 1,
      "maxDepth": 1,
      "pathCount": 1,
      "parentCount": 0,
      "childCount": 1
    }
  ],
  "edges": [
    {
      "from": "0x1fc2ca87dfb4b942ef0dc4ce420b46198451c56f5c8a1353e8b320bfa33ff4f4",
      "to": "0x65fda53426aad131da4262943667d7ff245819290d8106077385f2e3c5fbd664"
    },
    {
      "from": "0x1fc2ca87dfb4b942ef0dc4ce420b46198451c56f5c8a1353e8b320bfa33ff4f4",
      "to": "0x6607ad22c81a1253089c2e4dee9f6f5812af893e67a993fdcdb68760699d6082"
    },
    {
      "from": "0x1fc2ca87dfb4b942ef0dc4ce420b46198451c56f5c8a1353e8b320bfa33ff4f4",
      "to": "0x94c1d46d5db6c4b56429bad1d173bc258da6adf664ef365d9a59bd68284524d1"
    },
    {
      "from": "0x1fc2ca87dfb4b942ef0dc4ce420b46198451c56f5c8a1353e8b320bfa33ff4f4",
      "to": "0xd203f5b464cf38ef7555c6afe7c5c685e4c3d640565170605fcc25832c36b4d8"
    }
  ],
  "leaves": [
    "0x65fda53426aad131da4262943667d7ff245819290d8106077385f2e3c5fbd664",
    "0x6607ad22c81a1253089c2e4dee9f6f5812af893e67a993fdcdb68760699d6082",
    "0x94c1d46d5db6c4b56429bad1d173bc258da6adf664ef365d9a59bd68284524d1",
    "0xd203f5b464cf38ef7555c6afe7c5c685e4c3d640565170605fcc25832c36b4d8"
  ],
  "missingParents": [],
  "externalParents": [],
  "maxDepth": 1,
  "cycle": false
}
