{
  "root": "0xe61529bd245f91ad1a2719b587468920e070eafa91487d7228ca05d5b06eef16",
  "validationMode": "closed-world",
  "complete": true,
  "nodes": [
    {
      "hash": "0xe61529bd245f91ad1a2719b587468920e070eafa91487d7228ca05d5b06eef16",
      "minDepth": 0,
      "maxDepth": 0,
      "pathCount": 1,
      "parentCount": 2,
      "childCount": 0
    },
    {
      "hash": "0x92f0554ad39a45a3601989bbd8f1ff41e1e1e033b9d789a7b550f88ba87036d8",
      "minDepth": 1,
      "maxDepth": 1,
      "pathCount": 1,
      "parentCount": 0,
      "childCount": 1
    },
    {
      "hash": "0xb267da54bacb506cbc8987f2f60c83bcb76a127dbbe08f0763817071848b5d4c",
      "minDepth": 1,
      "maxDepth": 1,
      "pathCount": 1,
      "parentCount": 0,
      "childCount": 1
    }
  ],
  "edges": [
    {
      "from": "0xe61529bd245f91ad1a2719b587468920e070eafa91487d7228ca05d5b06eef16",
      "to": "0x92f0554ad39a45a3601989bbd8f1ff41e1e1e033b9d789a7b550f88ba87036d8"
    },
    {
      "from": "0xe61529bd245f91ad1a2719b587468920e070eafa91487d7228ca05d5b06eef16",
      "to": "0xb267da54bacb506cbc8987f2f60c83bcb76a127dbbe08f0763817071848b5d4c"
    }
  ],
  "leaves": [
    "0x92f0554ad39a45a3601989bbd8f1ff41e1e1e033b9d789a7b550f88ba87036d8",
    "0xb267da54bacb506cbc8987f2f60c83bcb76a127dbbe08f0763817071848b5d4c"
  ],
  "missingParents": [],
  "externalParents": [],
  "maxDepth": 1,
  "cycle": false
}
