{
  "root": "0x65fda53426aad131da4262943667d7ff245819290d8106077385f2e3c5fbd664",
  "validationMode": "closed-world",
  "complete": true,
  "nodes": [
    {
      "hash": "0x65fda53426aad131da4262943667d7ff245819290d8106077385f2e3c5fbd664",
      "minDepth": 0,
      "maxDepth": 0,
      "pathCount": 1,
      "parentCount": 0,
      "childCount": 0
    }
  ],
  "edges": [],
  "leaves": [
    "0x65fda53426aad131da4262943667d7ff245819290d8106077385f2e3c5fbd664"
  ],
  "missingParents": [],
  "externalParents": [],
  "maxDepth": 0,
  "cycle": false
}
