{
  "root": "0x49ed90723df6b2efea65c3435616aff8094394308fb3eb536281105ce4700ab4",
  "validationMode": "closed-world",
  "complete": true,
  "nodes": [
    {
      "hash": "0x49ed90723df6b2efea65c3435616aff8094394308fb3eb536281105ce4700ab4",
      "minDepth": 0,
      "maxDepth": 0,
      "pathCount": 1,
      "parentCount": 2,
      "childCount": 0
    },
    {
      "hash": "0x128396c6c30d8e3487b48312d8ef01a928c54d4b5d8df2c9ba2cdbc251d84bf6",
      "minDepth": 1,
      "maxDepth": 1,
      "pathCount": 1,
      "parentCount": 1,
      "childCount": 1
    },
    {
      "hash": "0x5466cc3adf4a91ea574964e4ab68b71f0d7384114e0b69e04425a0aae5411da3",
      "minDepth": 1,
      "maxDepth": 2,
      "pathCount": 2,
      "parentCount": 0,
      "childCount": 2
    }
  ],
  "edges": [
    {
      "from": "0x128396c6c30d8e3487b48312d8ef01a928c54d4b5d8df2c9ba2cdbc251d84bf6",
      "to": "0x5466cc3adf4a91ea574964e4ab68b71f0d7384114e0b69e04425a0aae5411da3"
    },
    {
      "from": "0x49ed90723df6b2efea65c3435616aff8094394308fb3eb536281105ce4700ab4",
      "to": "0x128396c6c30d8e3487b48312d8ef01a928c54d4b5d8df2c9ba2cdbc251d84bf6"
    },
    {
      "from": "0x49ed90723df6b2efea65c3435616aff8094394308fb3eb536281105ce4700ab4",
      "to": "0x5466cc3adf4a91ea574964e4ab68b71f0d7384114e0b69e04425a0aae5411da3"
    }
  ],
  "leaves": [
    "0x5466cc3adf4a91ea574964e4ab68b71f0d7384114e0b69e04425a0aae5411da3"
  ],
  "missingParents": [],
  "externalParents": [],
  "maxDepth": 2,
  "cycle": false
}
