{
  "root": "0x51cae12579b1f3894dd5762cd8198010d7f26a3b74b6dc27ffafd66123509130",
  "validationMode": "open-world",
  "complete": false,
  "nodes": [
    {
      "hash": "0x51cae12579b1f3894dd5762cd8198010d7f26a3b74b6dc27ffafd66123509130",
      "minDepth": 0,
      "maxDepth": 0,
      "pathCount": 1,
      "parentCount": 2,
      "childCount": 0
    },
    {
      "hash": "0x8c2733e732c2641cb82a467ae1b2c3f889a14de14414c8132611a5349b96bcd2",
      "minDepth": 1,
      "maxDepth": 1,
      "pathCount": 1,
      "parentCount": 0,
      "childCount": 1
    }
  ],
  "edges": [
    {
      "from": "0x51cae12579b1f3894dd5762cd8198010d7f26a3b74b6dc27ffafd66123509130",
      "to": "0x8c2733e732c2641cb82a467ae1b2c3f889a14de14414c8132611a5349b96bcd2"
    },
    {
      "from": "0x51cae12579b1f3894dd5762cd8198010d7f26a3b74b6dc27ffafd66123509130",
      "to": "0xbbbbbbbbbbbbbbbbbbbbbbbbbbbbbbbbbbbbbbbbbbbbbbbbbbbbbbbbbbbbbbbb"
    }
  ],
  "leaves": [
    "0x8c2733e732c2641cb82a467ae1b2c3f889a14de14414c8132611a5349b96bcd2"
  ],
  "missingParents": [],
  "externalParents": [
    "0xbbbbbbbbbbbbbbbbbbbbbbbbbbbbbbbbbbbbbbbbbbbbbbbbbbbbbbbbbbbbbbbb"
  ],
  "maxDepth": 1,
  "cycle": false
}
