{
  "root": "0x0c692557c50d43ebbc58d7d3b2790883907b71278224b453166a503c717b00df",
  "validationMode": "closed-world",
  "complete": true,
  "nodes": [
    {
      "hash": "0x0c692557c50d43ebbc58d7d3b2790883907b71278224b453166a503c717b00df",
      "minDepth": 0,
      "maxDepth": 0,
      "pathCount": 1,
      "parentCount": 2,
      "childCount": 0
    },
    {
      "hash": "0x51abaf54a82a83471188a54008cd508d1e96b1188796d9712a6d86284ac3719b",
      "minDepth": 1,
      "maxDepth": 1,
      "pathCount": 1,
      "parentCount": 0,
      "childCount": 1
    },
    {
      "hash": "0xced7410d56d2a18207862ba6bfb366ba45238de0bddcfb418352e9c3d5f0c8f3",
      "minDepth": 1,
      "maxDepth": 1,
      "pathCount": 1,
      "parentCount": 0,
      "childCount": 1
    }
  ],
  "edges": [
    {
      "from": "0x0c692557c50d43ebbc58d7d3b2790883907b71278224b453166a503c717b00df",
      "to": "0x51abaf54a82a83471188a54008cd508d1e96b1188796d9712a6d86284ac3719b"
    },
    {
      "from": "0x0c692557c50d43ebbc58d7d3b2790883907b71278224b453166a503c717b00df",
      "to": "0xced7410d56d2a18207862ba6bfb366ba45238de0bddcfb418352e9c3d5f0c8f3"
    }
  ],
  "leaves": [
    "0x51abaf54a82a83471188a54008cd508d1e96b1188796d9712a6d86284ac3719b",
    "0xced7410d56d2a18207862ba6bfb366ba45238de0bddcfb418352e9c3d5f0c8f3"
  ],
  "missingParents": [],
  "externalParents": [],
  "maxDepth": 1,
  "cycle": false
}
