{
  "root": "0x0000000000000000000000000000000000000000000000000000000000000001",
  "validationMode": "closed-world",
  "complete": true,
  "nodes": [
    {
      "hash": "0x0000000000000000000000000000000000000000000000000000000000000001",
      "minDepth": 0,
      "maxDepth": 0,
      "pathCount": 1,
      "parentCount": 1,
      "childCount": 0
    },
    {
      "hash": "0x0000000000000000000000000000000000000000000000000000000000000002",
      "minDepth": 1,
      "maxDepth": 1,
      "pathCount": 1,
      "parentCount": 0,
      "childCount": 1
    }
  ],
  "edges": [
    {
      "from": "0x0000000000000000000000000000000000000000000000000000000000000001",
      "to": "0x0000000000000000000000000000000000000000000000000000000000000002"
    }
  ],
  "leaves": [
    "0x0000000000000000000000000000000000000000000000000000000000000002"
  ],
  "missingParents": [],
  "externalParents": [],
  "maxDepth": 1,
  "cycle": false
}
